name,url,description,keywords
IAGA Members List,https://www.iaga-aiga.org/,Main IAGA mailing list for latest news and updates,geophysics;IAGA;news
IUGG e-Journal,https://iugg.org/publications/ejournals/,IUGG electronic journal for geophysics research,geophysics;IUGG;publications
GeoDAWG Mailing List,https://sites.google.com/view/geodawg/mailing-list,Geospace Digital Active Working Group mailing list,space physics;heliophysics;geospace
VERSIM,https://aurora.troja.mff.cuni.cz/versim/#banner,VLF/ELF Remote Sensing of Ionospheres and Magnetospheres working group,space physics;VLF;ELF;ionosphere
EMIW,https://www.emiw.org/members/registration,Electromagnetic Induction Workshop community (IAGA Division 6),geophysics;electromagnetic induction;IAGA
MTnet,http://mtnet.info/division/division.html,Magnetotelluric Network (IAGA Division 6),geophysics;magnetotellurics;IAGA
SEDI,https://iugg.org/associations-commissions/commissions/sedi/,Study of the Earth's Deep Interior commission,geophysics;deep earth;IUGG
GPMAG,https://lists.ucsd.edu/mailman/listinfo/gpmag-l,US Geophysics and Paleomagnetism mailing list,geophysics;paleomagnetism;US
JISCMAIL Geophysics,https://www.jiscmail.ac.uk/cgi-bin/webadmin?A0=GEOPHYSICS,UK academic mailing list for geophysics,geophysics;UK;academia
MIST,https://www.mist.ac.uk/community/mist-mailing-list,Magnetosphere Ionosphere Solar-Terrestrial UK community,space physics;solar-terrestrial;UK
MOP,https://lasp.colorado.edu/mop/resources/mop-conference/,Meeting of the Minds in Space Physics community,space physics;conferences
SCOSTEP,https://scostep.org/,Scientific Committee on Solar-Terrestrial Physics,space physics;solar-terrestrial;international
SPA AGU,https://connect.agu.org/spa/home,AGU Space Physics and Aeronomy section,space physics;AGU;aeronomy
ESA Heliophysics,https://www.cosmos.esa.int/web/esa-heliophysics/european-community,European Space Agency Heliophysics community,space physics;heliophysics;Europe;ESA
Heliophysics Europe,https://heliophysics.eu/,European heliophysics portal for news and resources,space physics;heliophysics;Europe;portal
SWEN,https://swe.ssa.esa.int/swen-newsletter,Space Weather Europe Newsletter,space weather;Europe;ESA
eSWAN,https://eswan.eu/index.php/newsletter/latest-newsletter,European Space Weather and Space Climate Analysis Network,space weather;space climate;Europe
Planetary News,https://www.planetarynews.org/,Planetary exploration news and updates,planetary science;exploration
Europlanet,https://www.europlanet-society.org/,European Planetary Science community,planetary science;Europe
UK Solar Physics,https://www.uksolphys.org/,UK Solar Physics community organization,solar physics;UK;community
UK Planetary Forum,https://www.ukpf.org.uk/,UK Planetary Science community forum,planetary science;UK;community
ATST France,https://atst.osups.universite-paris-saclay.fr/,Atelier Terre Solide et Temporalités community in France,solid earth;space physics;France;community
AEF Germany,http://aef-ev.de/,Arbeitsgemeinschaft Extraterrestrische Forschung (German Space Research Community),space research;Germany;community
Nordic Observatory,https://www.sgo.fi/NOC/,Nordic Observatory Meetings and Community,space physics;Nordic;observatory;community
MTNet EMinars,http://mtnet.info/EMinars/EMinars.html,Magnetotelluric Network online seminars,geophysics;magnetotellurics;seminars
Mag-NetZ,https://www2.earthref.org/MagIC/MagNetZ,Magnetic Network Zero seminars,geomagnetism;paleomagnetism;seminars
MIST Online Seminars,https://mist.ac.uk/meetings/mist-online-seminars,UK MIST community online seminars,space physics;solar-terrestrial;seminars;UK
ISSI Seminars,https://www.issibern.ch/online-seminars-game-changers/,International Space Science Institute online seminars,space science;seminars;international
Magnetosphere Seminars,https://msolss.github.io/MagSeminars/,Online magnetosphere seminar series,space physics;magnetosphere;seminars
GeoDAWG Seminars,https://sites.google.com/view/geodawg/seminars,Geospace Digital Active Working Group seminars,space physics;geospace;seminars
SHIELD Webinars,https://shielddrivecenter.com/shield-webinars/,NASA DRIVE Science Center webinar series,space physics;heliophysics;seminars;NASA
DeepDyn,https://www.geo.lmu.de/deepdyn/de/,Deep Earth Dynamics seminars,geophysics;deep earth;seminars
LatinMag,https://latinmag.geofisica.unam.mx/,Latin American Paleomagnetism community seminars,paleomagnetism;Latin America;seminars
EarthByte Seminars,https://www.earthbyte.org/category/earthbyte-seminars/,Earth dynamics and plate tectonics seminars,geodynamics;plate tectonics;seminars
HelioPython School,https://heliopython.org/summer-school-24,Python programming for heliophysics summer school,heliophysics;python;education;summer school
NASA FDL HelioLab,https://fdl.ai/heliolab,NASA Frontier Development Lab for heliophysics AI/ML applications,heliophysics;AI;machine learning;summer school;NASA
STFC Space Plasma Schools,https://www.ukri.org/what-we-do/developing-people-and-skills/stfc/training/types-of-training/short-courses-and-summer-schools/,UK STFC introductory and advanced space plasma physics schools,space physics;plasma;education;summer school;UK
Alpbach Summer School,https://www.summerschoolalpbach.at/,Annual space science and technology summer school in Austria,space science;technology;education;summer school;Europe
E-SWAN Schools,https://www.eswan.eu/index.php?id=139,European Space Weather and Space Climate Analysis Network summer schools,space weather;space climate;education;summer school;Europe
ISSS L'Aquila,https://www.cifs-isss.org/,International School of Space Science in L'Aquila,space science;education;summer school;Italy
SWEC,https://www.stce.be/SWEC,Space Weather Education Center training program,space weather;education;training;Belgium
NASA Heliophysics School,https://heliophysics.ucar.edu/summer-school,NASA Heliophysics Summer School at UCAR,heliophysics;education;summer school;NASA
ESA Space Weather Training,https://www.esa.int/Education/ESA_Academy/Stay_ahead_of_the_storm_understand_the_fundamentals_of_space_weather_with_ESA,ESA Academy training on space weather fundamentals,space weather;education;training;ESA
EISCAT Radar School,https://eiscat.se/events/,International EISCAT Radar School for ionospheric studies,radar;ionosphere;education;summer school;EISCAT
ISR Summer School,https://amisr.com/school/,Annual Incoherent Scatter Radar Summer School,radar;ionosphere;education;summer school;NSF
Culham Plasma School,https://culhamsummerschool.org.uk/,Culham plasma physics summer school,plasma physics;fusion;education;summer school;UK
L'Aquila CCHS School,https://www.astrogeofisica.it/cchs/DefaultCCHS.aspx,L'Aquila Conjugate Computing and High-performance Simulation school,computing;simulation;education;summer school;Italy
ML4PSP Seminars,https://ml4psp.github.io/,Machine Learning for Planetary Space Physics webinar series,machine learning;space physics;planetary;seminars
SCOSTEP Lectures,https://scostep.org/capacity-building/capacity-building-lectures/,SCOSTEP Capacity Building Lectures in solar-terrestrial physics,space physics;solar-terrestrial;education;seminars
ISWI Webinars,https://www.unoosa.org/oosa/en/ourwork/psa/bssi/iswi_webinars.html,International Space Weather Initiative Webinars,space weather;international;education;seminars
Cold Plasma Seminars,https://www.lanl.gov/engage/organizations/aldsct/theoretical/ampp/cold-plasma-seminars,LANL Cold Plasma Physics Seminar Series,plasma physics;space physics;seminars